{
  "schemaVersion": "v2-external-brain-screenshot-metadata/v6",
  "scenarioId": "px5_scenario_01",
  "capturedAt": "2026-09-08T10:39:50.416Z",
  "evidenceClass": "production_acceptance",
  "executionMode": "headless_real_chrome",
  "browser": "chrome",
  "viewport": {
    "width": 1280,
    "height": 900,
    "deviceScaleFactor": 1
  },
  "imagePath": "docs/active/project/evidence/v2_external_brain_productization/px-5/screenshots/workspace-library-1280.png",
  "imageSha256": "3cc34e565ece045eed0eb7359bd3f0f4d07b25bdba63aa6398b76bd228d7c425",
  "captureVariantId": "viewport_workspace_1280",
  "captureMode": "product_surface",
  "captureSurface": "workspace_page",
  "capturePhase": "route_ready",
  "containerEvidence": {
    "hostPageVisible": false,
    "sidePanelVisible": false,
    "workspaceVisible": true
  },
  "entryPoint": "open_workspace",
  "routeIntent": "source_library",
  "resolvedPath": "#/knowledge/sources?workspaceId=ws_default",
  "routeRecoveryResult": "not_applicable",
  "openOutcome": "created_new",
  "observedIds": {
    "sidePanel": {
      "status": "observed",
      "workspaceId": "ws_default"
    },
    "background": {
      "status": "observed",
      "workspaceId": "ws_default"
    },
    "runtime": {
      "status": "observed",
      "workspaceId": "ws_default",
      "sourceId": "src_00000000000000000000002843",
      "operationId": "op_00000000000000000000002844"
    },
    "workspace": {
      "status": "observed",
      "workspaceId": "ws_default"
    }
  },
  "statusObservation": {
    "schemaVersion": "v2-knowledge-status-draft-2026-07-10",
    "observedAt": "2026-09-08T10:39:50.416Z",
    "frontendInferredRuntimeStatus": "online",
    "runtimeStatus": "online",
    "adapterStatus": "ready",
    "dataServiceStatus": "unchecked",
    "sourceBuildStatus": "trace_ready",
    "capabilities": {
      "workspace": true,
      "sourceImport": true,
      "buildStatus": true,
      "query": true,
      "graph": true,
      "sourceTrace": true,
      "forgetVerification": true
    },
    "userAction": "none",
    "message": "Observed by PX-5 real Chrome automation.",
    "redactionApplied": true
  }
}
