{
  "schemaVersion": "v2-external-brain-screenshot-metadata/v6",
  "scenarioId": "px5_scenario_07",
  "capturedAt": "2026-09-08T10:39:50.416Z",
  "evidenceClass": "production_acceptance",
  "executionMode": "headless_real_chrome",
  "browser": "chrome",
  "viewport": {
    "width": 1280,
    "height": 900,
    "deviceScaleFactor": 1
  },
  "imagePath": "docs/active/project/evidence/v2_external_brain_productization/px-5/screenshots/workspace-source-detail-1280.png",
  "imageSha256": "cc32e31c30550bed213178119759bfe9f2de881a7645ac2bdab2dfc7b042d64b",
  "captureVariantId": "capture_px5_scenario_07",
  "captureMode": "product_surface",
  "captureSurface": "workspace_page",
  "capturePhase": "route_ready",
  "containerEvidence": {
    "hostPageVisible": false,
    "sidePanelVisible": false,
    "workspaceVisible": true
  },
  "entryPoint": "open_in_workspace",
  "routeIntent": "source_detail",
  "resolvedPath": "#/knowledge/sources/src_00000000000000000000009888?workspaceId=ws_default",
  "routeRecoveryResult": "not_applicable",
  "openOutcome": "focused_existing",
  "observedIds": {
    "sidePanel": {
      "status": "observed",
      "workspaceId": "ws_default",
      "sourceId": "src_00000000000000000000009888",
      "operationId": "op_00000000000000000000009889"
    },
    "background": {
      "status": "observed",
      "workspaceId": "ws_default",
      "sourceId": "src_00000000000000000000009888",
      "operationId": "op_00000000000000000000009889"
    },
    "runtime": {
      "status": "observed",
      "workspaceId": "ws_default",
      "sourceId": "src_00000000000000000000009888",
      "operationId": "op_00000000000000000000009889"
    },
    "workspace": {
      "status": "observed",
      "workspaceId": "ws_default",
      "sourceId": "src_00000000000000000000009888",
      "operationId": "op_00000000000000000000009889"
    }
  },
  "statusObservation": {
    "schemaVersion": "v2-knowledge-status-draft-2026-07-10",
    "observedAt": "2026-09-08T10:39:50.416Z",
    "frontendInferredRuntimeStatus": "online",
    "runtimeStatus": "online",
    "adapterStatus": "ready",
    "dataServiceStatus": "unchecked",
    "sourceBuildStatus": "trace_ready",
    "capabilities": {
      "workspace": true,
      "sourceImport": true,
      "buildStatus": true,
      "query": true,
      "graph": true,
      "sourceTrace": true,
      "forgetVerification": true
    },
    "userAction": "none",
    "message": "Observed by PX-5 real Chrome automation.",
    "redactionApplied": true
  }
}
