{
  "schemaVersion": "v2-external-brain-screenshot-metadata/v6",
  "scenarioId": "px5_scenario_24",
  "capturedAt": "2026-09-08T10:39:50.416Z",
  "evidenceClass": "production_acceptance",
  "executionMode": "headless_real_chrome",
  "browser": "chrome",
  "viewport": {
    "width": 1280,
    "height": 900,
    "deviceScaleFactor": 1
  },
  "imagePath": "docs/active/project/evidence/v2_external_brain_productization/px-5/screenshots/route-error-workspace-not-found-1280.png",
  "imageSha256": "5ece39695525522f31c9d3dd5edb89c6c2a3adbeeec8222bc7851caf60df188c",
  "captureVariantId": "capture_px5_scenario_24",
  "captureMode": "product_surface",
  "captureSurface": "route_error",
  "capturePhase": "error_recovery",
  "containerEvidence": {
    "hostPageVisible": false,
    "sidePanelVisible": false,
    "workspaceVisible": true
  },
  "entryPoint": "direct_route",
  "routeIntent": "source_library",
  "resolvedPath": "#/knowledge/sources?workspaceId=ws_default",
  "routeRecoveryResult": "recovered_to_library",
  "openOutcome": "recovered",
  "observedIds": {
    "sidePanel": {
      "status": "not_applicable"
    },
    "background": {
      "status": "not_applicable"
    },
    "runtime": {
      "status": "observed",
      "workspaceId": "ws_default",
      "sourceId": "src_00000000000000000000002843",
      "operationId": "op_00000000000000000000002844"
    },
    "workspace": {
      "status": "observed",
      "workspaceId": "ws_default"
    }
  },
  "statusObservation": {
    "schemaVersion": "v2-knowledge-status-draft-2026-07-10",
    "observedAt": "2026-09-08T10:39:50.416Z",
    "frontendInferredRuntimeStatus": "online",
    "runtimeStatus": "online",
    "adapterStatus": "ready",
    "dataServiceStatus": "unchecked",
    "sourceBuildStatus": "trace_ready",
    "capabilities": {
      "workspace": true,
      "sourceImport": true,
      "buildStatus": true,
      "query": true,
      "graph": true,
      "sourceTrace": true,
      "forgetVerification": true
    },
    "userAction": "none",
    "message": "Observed by PX-5 real Chrome automation.",
    "redactionApplied": true
  },
  "errorCode": "WORKSPACE_NOT_FOUND"
}
